id,question
104,What type of equipment does the dumbbell pullover type?
104,What type of equipment does the dumbbell pullover come in?
105,What body part does Barbell Shrug target?
105,What equipment is required for Barbell Shrug?
105,What muscles are used in Barbell Shrug?
105,What type of exercise is Barbell Shrug?
105,How do you perform Barbell Shrug correctly?
106,What type of equipment does T-Bar Row have?
106,What is the body part of the T-Bar Row?
106,What type of equipment is the T-Bar Row?
106,What kind of equipment does T-Bar Row use?
106,What type of equipment does the T-Bar Row have?
107,What body part does Bulgarian Deadlift target?
107,What type of exercise is Bulgarian Deadlift?
107,What type of equipment does the Bulgarian Deadlift use?
107,How do you perform Bulgarian Deadlift correctly?
107,What type of equipment does the Bulgarian Deadlift type have?
108,What type of equipment does the pistol squat use?
108,What type of equipment is used to use a pistol squat?
108,What type of exercise does Pistol Squat have?
108,What kind of equipment does Pistol Squat use?
108,What is the average number of muscles in Pistol Squat?
109,What equipment is required for Seated Leg Curl?
109,What body part does Seated Leg Curl target?
109,What type of exercise is Seated Leg Curl?
109,What muscles are used in Seated Leg Curl?
109,How do you perform Seated Leg Curl correctly?
110,How do you perform Russian Kettlebell Swing correctly?
110,What body part does Russian Kettlebell Swing target?
110,What muscles are used in Russian Kettlebell Swing?
110,What is the type of exercise used in the Russian Kettlebell Swing?
110,What equipment is required for Russian Kettlebell Swing?
111,What equipment is required for Incline Dumbbell Curl?
111,What muscles are used in Incline Dumbbell Curl?
111,How do you perform Incline Dumbbell Curl correctly?
111,What body part does Incline Dumbbell Curl target?
111,What type of exercise is Incline Dumbbell Curl?
112,What body part does Decline Sit-Ups target?
112,How do you perform Decline Sit-Ups correctly?
112,What muscles are used in Decline Sit-Ups?
112,What type of equipment does Decline Sit-Ups use?
112,What type of exercise is Decline Sit-Ups?
113,What is the difference between side plank dips and strength equipment?
113,What type of exercise is Side Plank Dips?
113,What type of equipment does Side Plank Dips have?
113,What type of equipment does Side Plank dips type?
113,What does Side Plank dips do?
114,What kind of equipment is the single arm kettlebell swing type?
114,What type of exercise is Single Arm Kettlebell Swing?
114,What equipment is required for Single Arm Kettlebell Swing?
114,What muscles are used in Single Arm Kettlebell Swing?
114,What body part does Single Arm Kettlebell Swing target?
115,What body part does Jumping Squats target?
115,What muscles are used in Jumping Squats?
115,What equipment is required for Jumping Squats?
115,What type of exercise is Jumping Squats?
115,What is the physical activity for jumping squats?
116,How do you perform Cable Chest Fly correctly?
116,What type of exercise is Cable Chest Fly?
116,What muscles are used in Cable Chest Fly?
116,What body part does Cable Chest Fly target?
116,What equipment is required for Cable Chest Fly?
117,What equipment is required for Dumbbell Tricep Extension?
117,What muscles are used in Dumbbell Tricep Extension?
117,What type of exercise is Dumbbell Tricep Extension?
117,What body part does Dumbbell Tricep Extension target?
117,How do you perform Dumbbell Tricep Extension correctly?
118,What is the purpose of the leg curl type?
118,How long did it take to get the leg curl?
118,What muscles are used in Leg Curl?
118,What equipment does the leg curl use?
118,What kind of exercise is the Leg Curl?
119,What body part does One-Arm Push-Up target?
119,How do you perform One-Arm Push-Up correctly?
119,What type of equipment does the one-arm push-up type?
119,What type of exercise is One-Arm Push-Up?
119,What is the weight of the one-arm push-up?
120,What type of equipment does the machine shoulder press?
120,What type of machine shoulder press do you use?
120,What is the purpose of the machine shoulder press?
120,What equipment does the machine shoulder press?
120,What equipment does the machine shoulder press type?
121,What type of exercises are used in the Sumo Squat?
121,What type of equipment does the sumo squat have?
121,What type of equipment does Sumo Squat use?
121,What type of equipment is the Sumo Squat?
121,What type of equipment is the sumo squat?
122,What are the exercises that are used in resistance band squat?
122,What muscles are used in Resistance Band Squat?
122,What body part does Resistance Band Squat target?
122,How do you perform Resistance Band Squat correctly?
122,What equipment is used in resistance band squat?
123,What equipment is the one-legged squat?
123,What type of equipment does one-legged squat use?
123,What type of equipment is the one-legged squat?
123,What type of exercise is most likely to be done in one-legged squat?
123,What type of equipment is a one-legged squat?
124,What type of equipment is Landmine Row?
124,What is the highest number of people who are on landmine row?
124,What does Landmine Row stand for?
124,What kind of equipment is Landmine Row?
124,What equipment does Landmine Row have?
125,How do you perform Superman Exercise correctly?
125,What type of exercise is Superman Exercise?
125,What body part does Superman Exercise target?
125,What muscles are used in Superman Exercise?
125,What equipment is required for Superman Exercise?
126,What muscles are used in Dumbbell Flyes?
126,What does the Dumbbell Flyes do?
126,What body part does Dumbbell Flyes target?
126,How do you perform Dumbbell Flyes correctly?
126,What type of exercise is Dumbbell Flyes?
127,What muscles are used in Reverse Fly?
127,How do you perform Reverse Fly correctly?
127,What does the reverse fly type consist of?
127,What is the main reason for a Reverse Fly?
127,What equipment is required for Reverse Fly?
128,What muscles are used in Cable Kickbacks?
128,How do you perform Cable Kickbacks correctly?
128,What body part does Cable Kickbacks target?
128,What equipment is required for Cable Kickbacks?
128,What type of exercise is Cable Kickbacks?
129,What type of press does the Kettlebell push press type?
129,What body part does Kettlebell Push Press target?
129,What type of exercise does the Kettlebell push press do?
129,How do you perform Kettlebell Push Press correctly?
129,What muscles are used in Kettlebell Push Press?
130,What kind of equipment does the Dead Bug use?
130,What kind of equipment is Dead Bug?
130,What type of equipment is the Dead Bug?
130,What type of exercises does Dead Bug have?
130,What type of exercise is Dead Bug?
131,What equipment is used in the Smith Machine Squat?
131,What muscles are used in Smith Machine Squat?
131,How do you perform Smith Machine Squat correctly?
131,What body part does Smith Machine Squat target?
131,What equipment is required for Smith Machine Squat?
132,What equipment is required for Reverse Hyperextension?
132,What body part does Reverse Hyperextension target?
132,What muscles are used in Reverse Hyperextension?
132,How do you perform Reverse Hyperextension correctly?
132,What type of exercise is Reverse Hyperextension?
133,How do you perform Landmine Twist correctly?
133,What type of exercise is Landmine Twist?
133,What muscles are used in Landmine Twist?
133,What equipment is required for Landmine Twist?
133,What body part does Landmine Twist target?
134,What type of equipment did the machine row use?
134,What is the size of machine row?
134,What is the shortest machine row type?
134,What is the equipment used for a machine row?
134,What is the baseline for a machine row?
135,How do you perform Seated Calf Raise correctly?
135,What body part does Seated Calf Raise target?
135,What muscles are used in Seated Calf Raise?
135,What type of exercise is Seated Calf Raise?
135,What equipment is required for Seated Calf Raise?
136,What muscles are used in Kettlebell Windmill?
136,What body part does Kettlebell Windmill target?
136,How do you perform Kettlebell Windmill correctly?
136,What equipment is required for Kettlebell Windmill?
136,What equipment is used in the Kettlebell Windmill?
137,What equipment is required for Incline Barbell Bench Press?
137,What body part does Incline Barbell Bench Press target?
137,What muscles are used in Incline Barbell Bench Press?
137,How do you perform Incline Barbell Bench Press correctly?
137,What type of exercise is Incline Barbell Bench Press?
138,What type of exercise is Kettlebell Goblet Squat?
138,What equipment is required for Kettlebell Goblet Squat?
138,How do you perform Kettlebell Goblet Squat correctly?
138,What body part does Kettlebell Goblet Squat target?
138,What muscles are used in Kettlebell Goblet Squat?
139,What muscles are used in Dumbbell Thrusters?
139,What type of exercise is Dumbbell Thrusters?
139,What types of exercise does Dumbbell Thrusters?
139,What type of exercises does Dumbbell Thrusters use?
139,What body part does Dumbbell Thrusters target?
140,How do you perform Lying Leg Curl correctly?
140,What type of exercise is Lying Leg Curl?
140,What body part does Lying Leg Curl target?
140,What equipment is required for Lying Leg Curl?
140,What muscles are used in Lying Leg Curl?
141,What equipment is required for Dumbbell Hammer Curl?
141,What equipment does the dumbbell hammer curl type?
141,What body part does Dumbbell Hammer Curl target?
141,What type of equipment does the dumbbell hammer curl type?
141,What kind of exercises does the dumbbell Hammer Curl have?
142,What type of exercise is Landmine Squat Press?
142,What type of equipment does Landmine Squat Press use?
142,What type of equipment does the landmine squat press use?
142,What type of equipment is Landmine Squat Press?
142,What type of equipment does Landmine Squat press use?
143,What are the exercises in Zottman Curl?
143,How do you perform Zottman Curl correctly?
143,What type of exercise is Zottman Curl?
143,What muscles are used in Zottman Curl?
143,What equipment does the zottman curl type have?
144,What type of exercise is Cable Crunch?
144,What body part does Cable Crunch target?
144,What muscles are used in Cable Crunch?
144,How do you perform Cable Crunch correctly?
144,What equipment is required for Cable Crunch?
145,What body part does Stability Ball Pike target?
145,What muscles are used in Stability Ball Pike?
145,What are the exercises that stability ball pike type?
145,What equipment is required for Stability Ball Pike?
145,What type of pike is the Stability Ball Pike?
146,What body part does Standing Calf Raise target?
146,What is the strength equipment used in standing Calf Raise?
146,What type of exercise is Standing Calf Raise?
146,What equipment is required for Standing Calf Raise?
146,What muscles are used in Standing Calf Raise?
147,How do you perform Cable Kickback correctly?
147,What are the exercises for the cable kickback type?
147,What muscles are used in Cable Kickback?
147,What equipment is required for Cable Kickback?
147,What body part does Cable Kickback target?
148,What type of exercise is Spider Push-Ups?
148,What are the three main muscles of the Spider Push-Ups?
148,What are the ages of the spider push-ups?
148,How do you perform Spider Push-Ups correctly?
148,What muscles are used in Spider Push-Ups?
149,What body part does Resistance Band Chest Press target?
149,What equipment is used in resistance band chest press?
149,What equipment is required for Resistance Band Chest Press?
149,What muscles are used in Resistance Band Chest Press?
149,What type of exercise is Resistance Band Chest Press?
150,What is the highest weight of a one-arm dumbbell row?
150,What equipment is required for One-Arm Dumbbell Row?
150,What is the first leg of a one-arm dumbbell row?
150,How do you perform One-Arm Dumbbell Row correctly?
150,What body part does One-Arm Dumbbell Row target?
151,What type of exercises does Incline Chest Press use?
151,What type of equipment does Incline Chest Press use?
151,What type of equipment does Incline Chest Press have?
151,What type of equipment does the INCLINE Chest press use?
151,What type of equipment does the Incline Chest press use?
152,What muscles are used in Machine Preacher Curl?
152,What type of equipment does the machine preacher curl?
152,What type of equipment does the machine preacher curl have?
152,What type of exercise is Machine Preacher Curl?
152,What equipment is required for Machine Preacher Curl?
153,What body part does Hanging Knee Raises target?
153,What equipment is required for Hanging Knee Raises?
153,What muscles are used in Hanging Knee Raises?
153,What type of exercise is Hanging Knee Raises?
153,How do you perform Hanging Knee Raises correctly?
154,How do you perform Decline Dumbbell Press correctly?
154,What type of exercise is Decline Dumbbell Press?
154,What body part does Decline Dumbbell Press target?
154,What kind of equipment is Decline Dumbbell Press?
154,What equipment is required for Decline Dumbbell Press?
155,What type of exercise is Glute Kickback?
155,What equipment is required for Glute Kickback?
155,What is the weight of the glute kickback?
155,What type of body part does the glute kickback type have?
155,How does glute kickback type work?
156,What type of machine is the machine chest press?
156,What kind of equipment does the machine Chest press use?
156,What type of equipment does the machine chest press use?
156,What type of equipment does machine chest press use?
156,What type of equipment does the machine Chest press use?
157,What is the main exercise in the single-leg squat?
157,What type of equipment does the single-leg squat have?
157,What is the type of exercise that can be performed with a single-leg squat?
157,What type of equipment does the single-leg squat use?
157,What is the best type of equipment for a single-leg squat?
158,What type of exercise is Push-Up to Row?
158,What body part does Push-Up to Row target?
158,What muscles are used in Push-Up to Row?
158,How do you perform Push-Up to Row correctly?
158,What equipment is required for Push-Up to Row?
159,What muscles are used in Smith Machine Row?
159,What body part does Smith Machine Row target?
159,How do you perform Smith Machine Row correctly?
159,What type of exercise is Smith Machine Row?
159,What equipment is required for Smith Machine Row?
160,What is the simplest equipment for a lat pullover?
160,What kind of equipment does the Lat pullover type have?
160,What type of equipment is the Lat Pullover?
160,What type of exercises does the lat pullover type have?
160,What type of equipment is the Lat Pullover type?
161,What type of exercise is Smith Machine Shoulder Press?
161,What body part does Smith Machine Shoulder Press target?
161,What type of machine does the Smith Machine Shoulder Press type?
161,What kind of equipment is the Smith Machine Shoulder Press?
161,What equipment is required for Smith Machine Shoulder Press?
162,How do you perform Cable Woodchopper correctly?
162,What equipment is required for Cable Woodchopper?
162,What type of exercise is Cable Woodchopper?
162,What muscles are used in Cable Woodchopper?
162,What body part does Cable Woodchopper target?
163,What equipment is required for Machine Back Extension?
163,What type of exercise is Machine Back Extension?
163,What type of equipment is used for a machine back extension?
163,What kind of equipment is used for a machine back extension?
163,How do you perform Machine Back Extension correctly?
164,What muscles are used in Prone Leg Curl?
164,What type of equipment does the prone leg curl type?
164,What body part does Prone Leg Curl target?
164,What type of exercise is Prone Leg Curl?
164,What type of equipment is the prone leg curl?
165,What muscles are used in Seated Dumbbell Press?
165,What body part does Seated Dumbbell Press target?
165,What type of exercise is Seated Dumbbell Press?
165,How do you perform Seated Dumbbell Press correctly?
165,What equipment is required for Seated Dumbbell Press?
166,What type of equipment is the weighted plank?
166,What is the weighted plank?
166,What equipment is required for Weighted Plank?
166,What type of exercise is Weighted Plank?
166,What is the weighted plank type?
167,What equipment does the step mill type have?
167,What kind of equipment is the Step Mill type?
167,What does Step Mill have in it?
167,What is the main component of the Step Mill?
167,What equipment did the step mill use?
168,What equipment is required for Standing Resistance Band Row?
168,How is the standing resistance band row characterized?
168,How do you perform Standing Resistance Band Row correctly?
168,What muscles are used in Standing Resistance Band Row?
168,What body part does Standing Resistance Band Row target?
169,What equipment does Dumbbell Lunge use?
169,What body part does Dumbbell Lunge target?
169,What muscles are used in Dumbbell Lunge?
169,What type of exercise is Dumbbell Lunge?
169,What equipment does the dumbbell lunge have?
170,What muscles are used in Reverse Curl?
170,What body part does Reverse Curl target?
170,What equipment is required for Reverse Curl?
170,What type of exercise is Reverse Curl?
170,How do you perform Reverse Curl correctly?
171,What exercise does a banded pull-up type of strength equipment use?
171,What type of exercise does the banded pull-up type use?
171,What equipment is used for a banded pull-up type?
171,How do you describe a banded pull-up type?
171,What type of equipment does a banded pull-up have?
172,What type of equipment does the cable face pull?
172,What type of equipment does the cable face pull use?
172,What type of equipment is used for the cable face pull?
172,What type of equipment does the cable face pull type?
172,What type of equipment is the cable face pull?
173,What equipment did the Turkish Get-Up type have?
173,How do you perform Turkish Get-Up correctly?
173,What muscles are used in Turkish Get-Up?
173,What body part does Turkish Get-Up target?
173,What type of equipment does the Turkish Get-Up type have?
174,What body part does Weighted Russian Twists target?
174,How do you perform Weighted Russian Twists correctly?
174,What is the shortest length of the weighted Russian twists?
174,What is the weighted Russian Twists type?
174,What type of exercise is Weighted Russian Twists?
175,What equipment is required for Cable Front Raise?
175,What kind of equipment does the cable front raise?
175,How do you perform Cable Front Raise correctly?
175,What type of exercise is Cable Front Raise?
175,What muscles are used in Cable Front Raise?
176,What muscles are used in Reverse Crunch?
176,How do you perform Reverse Crunch correctly?
176,What body part does Reverse Crunch target?
176,What equipment is required for Reverse Crunch?
176,What type of exercise is Reverse Crunch?
177,What body part does Cable Tricep Kickback target?
177,What equipment is required for Cable Tricep Kickback?
177,What muscles are used in Cable Tricep Kickback?
177,How do you perform Cable Tricep Kickback correctly?
177,What type of exercise is Cable Tricep Kickback?
178,What type of equipment does the Copenhagen plank have?
178,What muscles are used in Copenhagen Plank?
178,What body part does Copenhagen Plank target?
178,How do you perform Copenhagen Plank correctly?
178,What equipment is required for Copenhagen Plank?
179,What equipment did the Smith Machine Incline press use?
179,What type of equipment does Smith Machine Incline press type?
179,How is the Smith Machine Incline press rated?
179,What type of equipment does the Smith Machine Incline Press Type have?
179,What are the exercises that are performed on Smith Machine Incline Press?
180,What kind of equipment does the Cable Lat pulldown include?
180,What type of equipment does cable lat pulldown use?
180,What muscles are used in Cable Lat Pulldown?
180,What body part does Cable Lat Pulldown target?
180,What equipment is required for Cable Lat Pulldown?
181,What body part does Cable Side Lunge target?
181,What muscles are used in Cable Side Lunge?
181,How do you perform Cable Side Lunge correctly?
181,What type of exercise is Cable Side Lunge?
181,What type of equipment does the cable side lunge use?
182,What type of exercise is Dumbbell Bent-Over Row?
182,What muscles are used in Dumbbell Bent-Over Row?
182,What equipment is required for Dumbbell Bent-Over Row?
182,How do you perform Dumbbell Bent-Over Row correctly?
182,What body part does Dumbbell Bent-Over Row target?
183,What body part does Lateral Lunge target?
183,How do you perform Lateral Lunge correctly?
183,What equipment is required for Lateral Lunge?
183,What type of exercise is Lateral Lunge?
183,What muscles are used in Lateral Lunge?
184,What muscles are used in Seated Machine Row?
184,How do you perform Seated Machine Row correctly?
184,What body part does Seated Machine Row target?
184,What type of exercise is Seated Machine Row?
184,What equipment is required for Seated Machine Row?
185,What type of exercise is Decline Russian Twist?
185,What kind of equipment does Decline Russian Twist type?
185,What body part does Decline Russian Twist target?
185,How do you perform Decline Russian Twist correctly?
185,What muscles are used in Decline Russian Twist?
186,What body part does Deadlift High Pull target?
186,What type of exercise is Deadlift High Pull?
186,What muscles are used in Deadlift High Pull?
186,How do you perform Deadlift High Pull correctly?
186,What equipment is required for Deadlift High Pull?
187,How do you perform Reverse Grip Lat Pulldown correctly?
187,What type of equipment did the reverse grip lat pulldown type?
187,What muscles are used in Reverse Grip Lat Pulldown?
187,What type of exercise is Reverse Grip Lat Pulldown?
187,What body part does Reverse Grip Lat Pulldown target?
188,What muscles are used in Cable Lateral Lunge?
188,What type of exercise is Cable Lateral Lunge?
188,How do you perform Cable Lateral Lunge correctly?
188,What equipment is required for Cable Lateral Lunge?
188,What body part does Cable Lateral Lunge target?
189,What kind of equipment does Pike push-ups use?
189,What type of equipment does Pike push-ups use?
189,How does Pike Push-Up Type help your body?
189,What does the Pike push-up type have in common?
189,What type of equipment is the Pike Push-Up type?
190,How do you perform One-Arm Dumbbell Snatch correctly?
190,What equipment is required for One-Arm Dumbbell Snatch?
190,What muscles are used in One-Arm Dumbbell Snatch?
190,What body part does One-Arm Dumbbell Snatch target?
190,What type of exercise is One-Arm Dumbbell Snatch?
191,What body part does Cable Front Squat target?
191,What equipment is required for Cable Front Squat?
191,What muscles are used in Cable Front Squat?
191,What equipment is the Cable Front Squat?
191,What is the height of the cable front squat?
192,What is the weight of the person who uses the tire flip?
192,What equipment is required for Tire Flip?
192,What body part does Tire Flip target?
192,What muscles are used in Tire Flip?
192,What type of exercise is Tire Flip?
193,What equipment is required for Smith Machine Calf Raise?
193,How does the Smith Machine Calf Raise Workout?
193,What body part does Smith Machine Calf Raise target?
193,What type of exercise is Smith Machine Calf Raise?
193,How do you perform Smith Machine Calf Raise correctly?
194,What type of exercise is the Pistol Squat to Box?
194,What are the physical parts of Pistol Squat to Box?
194,How do you perform Pistol Squat to Box correctly?
194,What equipment is required for Pistol Squat to Box?
194,What body part does Pistol Squat to Box target?
195,What equipment is required for Standing Chest Fly?
195,What body part does Standing Chest Fly target?
195,What type of exercise is Standing Chest Fly?
195,How do you perform Standing Chest Fly correctly?
195,What muscles are used in Standing Chest Fly?
196,What type of equipment is Sled Drag?
196,What type of equipment does the sled drag?
196,What does the sled drag type do?
196,What equipment does the sled drag type?
196,What is the type of equipment that the sled drag is used for?
197,What body part does Cable Hammer Curl target?
197,What muscles are used in Cable Hammer Curl?
197,What equipment is required for Cable Hammer Curl?
197,How do you perform Cable Hammer Curl correctly?
197,What type of exercise is Cable Hammer Curl?
198,What body part does Cable Tricep Overhead Extension target?
198,What equipment is required for Cable Tricep Overhead Extension?
198,What type of exercise is Cable Tricep Overhead Extension?
198,How do you perform Cable Tricep Overhead Extension correctly?
198,What muscles are used in Cable Tricep Overhead Extension?
199,What type of exercise is Seated Cable Row?
199,What body part does Seated Cable Row target?
199,What equipment is used in the Seated Cable Row?
199,What muscles are used in Seated Cable Row?
199,What equipment is required for Seated Cable Row?
200,What muscles are used in Lying Dumbbell Tricep Extension?
200,What equipment is required for Lying Dumbbell Tricep Extension?
200,What type of exercise is Lying Dumbbell Tricep Extension?
200,How do you perform Lying Dumbbell Tricep Extension correctly?
200,What body part does Lying Dumbbell Tricep Extension target?
201,What equipment does the weighted pull-up use?
201,What type of exercise does the weighted pull-up type have?
201,What equipment is the weighted pull-up type?
201,What is the weighted pull-up type of exercise?
201,What type of equipment is the weighted pull-up type?
202,What type of exercise is Incline Dumbbell Row?
202,How do you perform Incline Dumbbell Row correctly?
202,What equipment is required for Incline Dumbbell Row?
202,What body part does Incline Dumbbell Row target?
202,What muscles are used in Incline Dumbbell Row?
203,What equipment is the machine Lat pulldown type?
