id,question
0,What type of equipment does Push-Ups use?
0,What type of equipment does push-ups have?
0,What type of equipment is used for push-ups?
0,What equipment is used to do push-ups?
0,What type of equipment does push-ups come in?
1,What exercise is used to perform squats?
1,What type of equipment does the squats use?
1,What type of exercises are used in squats?
1,What is the type of equipment for squats?
1,What is the type of exercise that the squats are?
2,What is the weight of a plank?
2,What type of equipment does the plank type have?
2,What is the number of muscles in a plank?
2,What is the shortest amount of time the planks should be?
2,What is the first word in a plank?
3,What kind of exercises does the Deadlift Type have?
3,What type of equipment does the deadlift use?
3,What kind of equipment does a deadlift use?
3,What kind of exercises does the deadlift do?
3,What are the types of equipment that are used in a Deadlift?
4,What are the names of the muscles that have the bicep curls?
4,What types of muscles does the Bicep Curls have?
4,What type of equipment does the Bicep Curls have?
4,What types of exercises are used to perform the bicep curls?
4,What type of exercise is the bicep curls?
5,What is the type of exercise used for a Kettlebell Swing?
5,What body part does Kettlebell Swing target?
5,What equipment is required for Kettlebell Swing?
5,What type of exercise is Kettlebell Swing?
5,What muscles are used in Kettlebell Swing?
6,What type of exercise is Shoulder Press?
6,What muscles are used in Shoulder Press?
6,What is the difference between the right and wrong position of the shoulder press?
6,What equipment is required for Shoulder Press?
6,What body part does Shoulder Press target?
7,What type of equipment does the Lat Pulldown have?
7,What is the main exercise that is used to perform the Lat Pulldown?
7,What type of equipment does a lat pulldown use?
7,What type of equipment is the lat pulldown?
7,What is the muscle group of lat pulldown?
8,What muscles are used in Hamstring Stretch?
8,What body part does Hamstring Stretch target?
8,What type of exercise is hamstring stretch?
8,What equipment is required for Hamstring Stretch?
8,What equipment does the hamstring stretch do?
9,What muscles are used in Jumping Jacks?
9,What are the names of the people who do jumping jacks?
9,What equipment is required for Jumping Jacks?
9,What type of exercise is Jumping Jacks?
9,What type of equipment does Jumping Jacks have?
10,What type of equipment does the bench press use?
10,What are the exercises that can be used in a bench press?
10,What is the difference between a bench press and a dumbbell?
10,What type of exercise does bench press use?
10,What type of exercise is the bench press?
11,What type of exercise is Lunges?
11,What is the weight of the lunges?
11,What equipment does the lunges use?
11,What body part does Lunges target?
11,What muscles are used in Lunges?
12,What is the active weight for pull-ups?
12,What muscles are used in Pull-Ups?
12,What equipment is required for Pull-Ups?
12,What body part does Pull-Ups target?
12,What type of exercise is Pull-Ups?
13,What muscles are used in Mountain Climbers?
13,What equipment is required for Mountain Climbers?
13,What type of exercise is Mountain Climbers?
13,What type of exercise is considered in the Mountain Climbers?
13,What body part does Mountain Climbers target?
14,How do you perform Leg Raises correctly?
14,What equipment is required for Leg Raises?
14,What muscles are used in Leg Raises?
14,What body part does Leg Raises target?
14,What type of exercise is Leg Raises?
15,What equipment is required for Tricep Dips?
15,What body part does Tricep Dips target?
15,What type of exercise is needed to perform the Tricep dips?
15,What type of exercise is Tricep Dips?
15,What kind of exercise does the tricep dips have?
16,What body part does Russian Twists target?
16,What type of equipment is the Russian Twists?
16,What equipment is required for Russian Twists?
16,What kind of equipment does the Russian Twists use?
16,What is the physical activity of the muscles in Russian Twists?
17,What equipment does Burpees use to do cardio?
17,What is the body weight of the burpees?
17,What type of equipment is the Burpees?
17,What type of exercise does the Burpees use?
17,What type of exercise does the burpees use?
18,How do you perform Dumbbell Rows correctly?
18,What body part does Dumbbell Rows target?
18,What muscles are used in Dumbbell Rows?
18,What is the baseline for the Dumbbell Rows?
18,What equipment is required for Dumbbell Rows?
19,What types of equipment does Goblet Squats use?
19,What type of equipment does the goblet squats use?
19,How do you perform Goblet Squats correctly?
19,What equipment is required for Goblet Squats?
19,What type of exercise is Goblet Squats?
20,What does the Glute Bridge use to help with?
20,What is the main purpose of the Glute Bridge?
20,What type of equipment is Glute Bridge?
20,What type of equipment does the Glute Bridge have?
20,What is the weight of the glute bridge?
21,What equipment is required for Overhead Tricep Extension?
21,What type of exercise is Overhead Tricep Extension?
21,What muscles are used in Overhead Tricep Extension?
21,What body part does Overhead Tricep Extension target?
21,How do you perform Overhead Tricep Extension correctly?
22,What type of equipment does the Side Plank type?
22,What is the weight of the side plank?
22,What kind of exercise is a side plank?
22,What is the type of equipment for the side plank type?
22,What type of exercise is Side Plank?
23,What is the weight of the equipment for the cable flyes?
23,What type of equipment does the cable flyes use?
23,What type of equipment does the Cable Flyes use?
23,What is the weight of the cable flyes?
23,What type of equipment is the cable flyes?
24,What type of exercise is Step-Ups?
24,What is the difference between step-ups and strength equipment?
24,What equipment is required for Step-Ups?
24,What is the physical activity of the step-ups?
24,How do you perform Step-Ups correctly?
25,What equipment is required for Barbell Rows?
25,What equipment does the Barbell Rows have?
25,How do you perform Barbell Rows correctly?
25,What body part does Barbell Rows target?
25,What equipment is used to hold Barbell Rows?
26,What type of equipment does Chest press use?
26,What type of equipment is the chest press?
26,How is the chest press made?
26,What type of equipment does the chest press use?
26,How does Chest Press type: Strength equipment?
27,What type of equipment do you need to perform box jumps?
27,What kind of equipment does Box Jumps have?
27,What type of equipment is the box jumps?
27,What type of exercise is Box Jumps?
27,How long is it for box jumps?
28,What body part does Hanging Leg Raises target?
28,What is the exercise name for the hanging leg Raises?
28,What type of exercise is Hanging Leg Raises?
28,How do you perform Hanging Leg Raises correctly?
28,What muscles are used in Hanging Leg Raises?
29,What type of equipment does the farmer's walk use?
29,What muscles are used in Farmer's Walk?
29,What type of exercise is Farmer's Walk?
29,What is the gimmick for Farmer's Walk?
29,How do you perform Farmer's Walk correctly?
30,How do you perform Calf Raises correctly?
30,What equipment is required for Calf Raises?
30,What body part does Calf Raises target?
30,What kind of equipment did Calf Raises have?
30,What type of exercise is Calf Raises?
31,What type of equipment is used in the Battle Ropes?
31,What are the exercises that were performed at the Battle Ropes?
31,What is the physical activity of the Battle Ropes?
31,What type of equipment does the Battle Ropes have?
31,What type of equipment is the Battle Ropes?
32,What body part does Medicine Ball Slams target?
32,What muscles are used in Medicine Ball Slams?
32,What equipment is required for Medicine Ball Slams?
32,What type of exercise is Medicine Ball Slams?
32,What sport is Medicine Ball Slams?
33,How do you perform Dumbbell Deadlift correctly?
33,What muscles are used in Dumbbell Deadlift?
33,What type of exercise is Dumbbell Deadlift?
33,What body part does Dumbbell Deadlift target?
33,What kind of equipment does the Dumbbell Deadlift have?
34,What type of equipment does Push press use?
34,What type of equipment does push press type?
34,What type of equipment is used to use push press?
34,What type of equipment does the push press use?
34,What type of equipment does the push press have?
35,What type of exercise is Treadmill Run?
35,What body part does Treadmill Run target?
35,How do you perform Treadmill Run correctly?
35,What muscles are used in Treadmill Run?
35,What is the calorie count for the treadmill run?
36,How do you perform Incline Dumbbell Press correctly?
36,What type of presses does Incline Dumbbell press use?
36,What body part does Incline Dumbbell Press target?
36,What type of equipment does Incline dumbbell press do?
36,What muscles are used in Incline Dumbbell Press?
37,How do you perform Renegade Rows correctly?
37,What kind of equipment does Renegade Rows use?
37,What muscles are used in Renegade Rows?
37,What body part does Renegade Rows target?
37,What type of exercise is Renegade Rows?
38,What equipment is required for Leg Press?
38,What body part does Leg Press target?
38,What type of equipment does Leg press use?
38,What muscles are used in Leg Press?
38,How do you perform Leg Press correctly?
39,What body part does Cable Tricep Pushdown target?
39,How do you perform Cable Tricep Pushdown correctly?
39,What type of exercise is Cable Tricep Pushdown?
39,What muscles are used in Cable Tricep Pushdown?
39,What equipment is required for Cable Tricep Pushdown?
40,What type of equipment is needed to perform a single-leg deadlift?
40,How do you perform Single-Leg Deadlift correctly?
40,What type of exercise is Single-Leg Deadlift?
40,What is the definition of the exercise for a single-leg deadlift?
40,What are the exercises that are used in a single-leg deadlift?
41,What equipment is required for Inverted Rows?
41,What body part does Inverted Rows target?
41,What muscles are used in Inverted Rows?
41,What type of exercise is Inverted Rows?
41,How do you perform Inverted Rows correctly?
42,What kind of equipment does the Pallof press use?
42,What type of equipment does Pallof press use?
42,What is the purpose of Pallof Press?
42,What is the purpose of the Pallof Press?
42,What type of equipment does Pallof press have?
43,What equipment is used to make a Kettlebell Deadlift?
43,What is the most important equipment for a Kettlebell Deadlift?
43,What type of equipment does the Kettlebell Deadlift have?
43,What is the purpose of the Kettlebell Deadlift?
43,What is the type of equipment used in the Kettlebell Deadlift?
44,What equipment is required for Hanging Knee Tucks?
44,How do you perform Hanging Knee Tucks correctly?
44,What body part does Hanging Knee Tucks target?
44,What type of exercise is Hanging Knee Tucks?
44,What muscles are used in Hanging Knee Tucks?
45,What equipment does the resistance band pull aparts use?
45,What equipment is required for Resistance Band Pull Aparts?
45,What type of exercise is Resistance Band Pull Aparts?
45,How do you perform Resistance Band Pull Aparts correctly?
45,What body part does Resistance Band Pull Aparts target?
46,What types of exercises does the Bulgarian Split Squats type?
46,What type of exercise does bulgarian split squats use?
46,What type of exercise does the bulgarian split squats have?
46,What type of equipment does the Bulgarian Split Squats have?
46,What type of equipment is the Bulgarian split squats?
47,What body part does Seated Shoulder Press target?
47,How do you perform Seated Shoulder Press correctly?
47,What equipment is required for Seated Shoulder Press?
47,What type of exercise is Seated Shoulder Press?
47,What muscles are used in Seated Shoulder Press?
48,What equipment is required for Incline Push-Ups?
48,What body part does Incline Push-Ups target?
48,What type of exercise is Incline Push-Ups?
48,How do you perform Incline Push-Ups correctly?
48,What type of equipment does Incline push-ups have?
49,What muscles are used in Hip Thrusts?
49,How do you perform Hip Thrusts correctly?
49,What is the shape of the hip thrusts?
49,What body part does Hip Thrusts target?
49,What is the body part of the hip thrusts?
50,What is the type of equipment for barbell curl?
50,What equipment is required for Barbell Curl?
50,What kind of equipment does the barbell curl type?
50,What type of exercises does the barbell curl type?
50,What muscles are used in Barbell Curl?
51,What is the activity that is performed on the cable row?
51,What is the weight of the cable row?
51,What is the height of the cable row?
51,What is the shape of the cable row?
51,What is the size of the cable row?
52,What type of equipment does plank shoulder taps use?
52,What type of exercise does plank shoulder taps take?
52,How do I use the plank shoulder taps?
52,What type of device does Plank Shoulder Taps use?
52,What kind of equipment does plank shoulder taps have?
53,What type of exercise does the Dumbbell Lateral Raise Type have?
53,What muscles are used in Dumbbell Lateral Raise?
53,What body part does Dumbbell Lateral Raise target?
53,What type of equipment does the Dumbbell lateral raise?
53,What equipment is required for Dumbbell Lateral Raise?
54,What body part does Wall Sit target?
54,What muscles are used in Wall Sit?
54,What kind of equipment is the wall sit?
54,What type of equipment does the wall sit have?
54,What equipment is required for Wall Sit?
55,What is the weight of the spider plank?
55,What is the size of the spider plank?
55,What type of equipment is the spider plank?
55,What is the type of body part that is used in the spider plank?
55,What type of equipment is Spider Plank?
56,What is the purpose of the Sumo Deadlift type?
56,What kind of exercises do Sumo Deadlift type?
56,What equipment does the Sumo Deadlift Type use?
56,What type of equipment does the Sumo Deadlift include?
56,What type of exercise is Sumo Deadlift?
57,What muscles are used in Single Arm Dumbbell Row?
57,How do you perform Single Arm Dumbbell Row correctly?
57,What body part does Single Arm Dumbbell Row target?
57,What type of exercise is Single Arm Dumbbell Row?
57,What equipment is required for Single Arm Dumbbell Row?
58,What type of exercise is Kettlebell Clean and Press?
58,What does a Kettlebell Clean and Press type have?
58,How do you perform Kettlebell Clean and Press correctly?
58,What body part does Kettlebell Clean and Press target?
58,What equipment is required for Kettlebell Clean and Press?
59,What is the size of the jump rope?
59,What body part does Jump Rope target?
59,What type of exercise is Jump Rope?
59,What type of equipment does a jump rope work?
59,What is the length of jump rope?
60,What kind of exercise does Side Lunge take?
60,What kind of equipment are the side lunges?
60,What type of equipment does side lunge have?
60,What type of equipment does Side Lunge have?
60,What type of equipment does Side Lunge use?
61,What type of equipment does machine chest fly?
61,What type of equipment is machine chest fly?
61,What equipment does the machine Chest fly use?
61,What type of equipment is the machine chest fly?
61,What equipment does the machine Chest Fly use?
62,What type of exercise is Hack Squat?
62,What equipment is required for Hack Squat?
62,What muscles are used in Hack Squat?
62,How do you perform Hack Squat correctly?
62,What body part does Hack Squat target?
63,What type of exercise is Decline Push-Ups?
63,What equipment is required for Decline Push-Ups?
63,What muscles are used in Decline Push-Ups?
63,How do you perform Decline Push-Ups correctly?
63,What body part does Decline Push-Ups target?
64,What type of exercise does the band face pull?
64,What equipment does the band face pull type?
64,How is the band face pull different from the other exercises?
64,What type of equipment does the band face pull?
64,How is the band face pull?
65,What is the function of Ab Wheel Rollout type?
65,What type of equipment does the Ab Wheel rollout have?
65,What are the exercises in the ab wheel rollout?
65,What is the type of tool used to rollout the Ab Wheel Rollout?
65,What kind of equipment does Ab Wheel Rollout have?
66,What body part does Side Leg Raises target?
66,What muscles are used in Side Leg Raises?
66,What kind of exercise is performed on Side Leg Raises?
66,How do you perform Side Leg Raises correctly?
66,What type of exercise is Side Leg Raises?
67,What type of equipment does the Romanian deadlift use?
67,How do you perform Romanian Deadlift correctly?
67,What body part does Romanian Deadlift target?
67,What equipment is required for Romanian Deadlift?
67,What muscles are used in Romanian Deadlift?
68,What type of equipment does the Arnold press type?
68,What does the Arnold press type have?
68,What are the exercises that Arnold Press uses?
68,What type of equipment does Arnold press have?
68,What are the exercises that were performed by Arnold Press?
69,What type of equipment does the Landmine press use?
69,What type of equipment does Landmine press type?
69,What type of equipment does Landmine press use?
69,What is the purpose of a landmine press?
69,"What is the calorie content of the word ""landmine press""?"
70,What body part does Tuck Jumps target?
70,What type of equipment does Tuck Jumps have?
70,What type of equipment is the Tuck Jumps?
70,How do you perform Tuck Jumps correctly?
70,What muscles are used in Tuck Jumps?
71,What equipment is required for Windshield Wipers?
71,What are the physical features of the windshield wipers?
71,What type of exercise is Windshield Wipers?
71,What muscles are used in Windshield Wipers?
71,How do you perform Windshield Wipers correctly?
72,What type of exercise is Dumbbell Shrugs?
72,What muscles are used in Dumbbell Shrugs?
72,How do you perform Dumbbell Shrugs correctly?
72,What body part does Dumbbell Shrugs target?
72,What equipment is required for Dumbbell Shrugs?
73,What type of exercise is Sled Push?
73,What is the difference between a sled push and a sled push?
73,What is the main purpose of the Sled Push?
73,What are the pros and cons of Sled Push?
73,What kind of exercise is the sled push type?
74,What body part does Cable Bicep Curl target?
74,What muscles are used in Cable Bicep Curl?
74,How do you perform Cable Bicep Curl correctly?
74,What equipment is required for Cable Bicep Curl?
74,What type of exercise is Cable Bicep Curl?
75,How do you perform Dumbbell Kickback correctly?
75,What type of exercise does the dumbbell kickback use?
75,What sport does the Dumbbell kickback type involve?
75,What are the different types of muscles used for the dumbbell kickback?
75,What type of exercise is Dumbbell Kickback?
76,What type of workout is the Flutter Kicks?
76,What type of equipment is Flutter Kicks?
76,How is Flutter Kicks different from other exercises?
76,What type of equipment did Flutter Kicks have?
76,What are the exercises that Flutter kicks should be?
77,What are the exercises that can be used to do high knees?
77,What type of equipment does the high knees use?
77,What is the exercise name for the high knees type?
77,What equipment does the high knees have?
77,What type of equipment do high knees use?
78,What muscles are used in Sledgehammer Slams?
78,What type of exercise is Sledgehammer Slams?
78,What sport is sledgehammer Slams?
78,What equipment is required for Sledgehammer Slams?
78,How do you perform Sledgehammer Slams correctly?
79,What type of exercise is Lateral Step-Ups?
79,What muscles are used in Lateral Step-Ups?
79,What body part does Lateral Step-Ups target?
79,How do you perform Lateral Step-Ups correctly?
79,What equipment is required for Lateral Step-Ups?
80,What equipment does Cable Chest Press use?
80,What kind of equipment does the cable chest press have?
80,What kind of equipment does the cable chest press use?
80,What is the size of the cable chest press?
80,What type of equipment does the cable chest press use?
81,What body part does TRX Rows target?
81,What are the exercises TRX Rows do?
81,What muscles are used in TRX Rows?
81,What type of exercise is TRX Rows?
81,What is TRX Rows Type?
82,What type of exercise is Medicine Ball Russian Twists?
82,What body part does Medicine Ball Russian Twists target?
82,What equipment is required for Medicine Ball Russian Twists?
82,How do you perform Medicine Ball Russian Twists correctly?
82,What muscles are used in Medicine Ball Russian Twists?
83,How do you perform Pendlay Row correctly?
83,What body part does Pendlay Row target?
83,What muscles are used in Pendlay Row?
83,What kind of equipment does Pendlay Row have?
83,What equipment is required for Pendlay Row?
84,What type of exercise is Side Plank with Leg Lift?
84,What body part does Side Plank with Leg Lift target?
84,What muscles are used in Side Plank with Leg Lift?
84,How do you perform Side Plank with Leg Lift correctly?
84,What equipment is required for Side Plank with Leg Lift?
85,What is the physical activity for a hip abduction?
85,How do you perform Hip Abduction correctly?
85,What is the exercise name for the hip abduction system?
85,What body part does Hip Abduction target?
85,What equipment is required for Hip Abduction?
86,What equipment is required for Dumbbell Front Raise?
86,What muscles are used in Dumbbell Front Raise?
86,What type of exercise is Dumbbell Front Raise?
86,What equipment does the Dumbbell Front raise?
86,What body part does Dumbbell Front Raise target?
87,What type of equipment does the chin-ups use?
87,What type of exercise is Chin-Ups?
87,What are the exercises that chin-ups do?
87,What body part does Chin-Ups target?
87,What equipment is required for Chin-Ups?
88,What type of equipment is in box squat?
88,What equipment does the box squat use?
88,What type of equipment does Box Squat use?
88,What type of equipment does box squat use?
88,What type of equipment does the box squat work for?
89,What type of exercise is Battle Rope Waves?
89,What body part does Battle Rope Waves target?
89,What equipment is required for Battle Rope Waves?
89,What muscles are used in Battle Rope Waves?
89,How do you perform Battle Rope Waves correctly?
90,What are the two exercises that Zercher Squat is the same?
90,What kind of exercise is Zercher Squat?
90,What equipment does the Zercher Squat type have?
90,What type of equipment does Zercher Squat use?
90,What equipment is used in the Zercher Squat?
91,What body part does Walking Lunges target?
91,What kind of exercise does walking lunges have?
91,What is the physical activity of walking lunges?
91,What muscles are used in Walking Lunges?
91,What equipment is required for Walking Lunges?
92,What type of equipment does the Kettlebell Snatch Type have?
92,What type of exercise is the Kettlebell Snatch?
92,What kind of equipment does the Kettlebell snatch type?
92,What is the calorie count for the Kettlebell Snatch?
92,What is the calorie count for a Kettlebell Snatch?
93,What equipment is used for a single-leg Glute Bridge?
93,What is the weight of a single-leg glute bridge?
93,What type of exercise is Single-Leg Glute Bridge?
93,What muscles are used in Single-Leg Glute Bridge?
93,What body part does Single-Leg Glute Bridge target?
94,What kind of muscles do the TRX push-ups have?
94,What are the exercises that TRX push-ups use?
94,What equipment is TRX push-ups?
94,What kind of equipment is TRX push-ups?
94,What is TRX Push-Ups?
95,What type of exercise is Machine Leg Curl?
95,What body part does Machine Leg Curl target?
95,How do you perform Machine Leg Curl correctly?
95,What muscles are used in Machine Leg Curl?
95,What equipment is required for Machine Leg Curl?
96,What type of exercise does Incline Bench Press use?
96,What equipment is required for Incline Bench Press?
96,What type of exercise is Incline Bench Press?
96,What muscles are used in Incline Bench Press?
96,What body part does Incline Bench Press target?
97,What muscles are used in Resistance Band Deadlift?
97,What type of exercise is Resistance Band Deadlift?
97,What body part does Resistance Band Deadlift target?
97,What equipment is required for Resistance Band Deadlift?
97,How do you perform Resistance Band Deadlift correctly?
98,What equipment is required for Decline Bench Press?
98,What type of exercise is Decline Bench Press?
98,How do you perform Decline Bench Press correctly?
98,What body part does Decline Bench Press target?
98,What type of equipment does Decline Bench Press have?
99,What body part does Dumbbell Step-Up target?
99,What equipment is required for Dumbbell Step-Up?
99,What is the main purpose of the Dumbbell Step-Up?
99,What muscles are used in Dumbbell Step-Up?
99,What type of exercise is Dumbbell Step-Up?
100,What equipment is required for Cable Lateral Raise?
100,What muscles are used in Cable Lateral Raise?
100,How do you perform Cable Lateral Raise correctly?
100,What body part does Cable Lateral Raise target?
100,What type of exercise is Cable Lateral Raise?
101,What body part does Reverse Lunge target?
101,How do you perform Reverse Lunge correctly?
101,What muscles are used in Reverse Lunge?
101,What equipment is required for Reverse Lunge?
101,What type of exercise is Reverse Lunge?
102,What type of exercise is Toe Touches?
102,What muscles are used in Toe Touches?
102,How do you perform Toe Touches correctly?
102,What body part does Toe Touches target?
102,What equipment is required for Toe Touches?
103,What body part does Machine Leg Extension target?
103,What kind of equipment is machine leg extension?
103,How do you perform Machine Leg Extension correctly?
103,What type of exercise is Machine Leg Extension?
103,What equipment is required for Machine Leg Extension?
104,What types of muscles are the Dumbbell Pullover?
104,What is the type of dumbbell pullover that is used to lift weights?
104,What equipment does a dumbbell pullover type?
