id,question
203,What is the length of machine lat pulldown?
203,What type of equipment does machine Lat Pulldown use?
203,What type of equipment does machine Lat pulldown use?
203,What kind of equipment is used in machine Lat Pulldown?
204,What is the weight of the one-arm cable row?
204,What is the weight of one-arm cable row?
204,What is the most important activity for one-arm cable row?
204,What is the type of equipment for one-arm cable row?
204,What type of equipment does one-arm cable row use?
205,What type of exercise is Face Pull?
205,What equipment is required for Face Pull?
205,How do you perform Face Pull correctly?
205,What muscles are used in Face Pull?
205,What body part does Face Pull target?
206,What type of equipment does the dumbbell bench press have?
206,What is the proper weight for a dumbbell bench press?
206,What equipment did the dumbbell bench press type?
206,What kind of equipment is used for a dumbbell bench press?
206,What type of equipment does the dumbbell bench press?
